user_name,user_id,web,sex,time,play_time,score,comment,phone,huanle,dianzan,dianxia
Watermelon,6126431,https://www.taptap.com/user/6126431,gender-empty,2017-11-07 08:43:49,,5,全部通关，打算又去把1玩一遍。说实话，从玩完纪念碑谷1到现在的2，有很多莫名戳中我心里的点。“你还未完全了解爱，好坏参半，而你上需前行。”艾达和妈妈拥抱的场景，还有果园里的树依靠光源可以看到一颗植物的成长，让我有很多惊艳。还有码头妈妈送艾达离开，让我莫名的心酸，我们即将远去，父母的身影在码头眺望子女远去的身影，“树欲静而风不止，子欲养而亲不在”。这只是自己的感触，不喜勿喷。在讲堂那章，初形，初心，初行，当所有人都以为我过的风生水起的时候 我只是一个人走了一段又一段艰难的路。虽然纪念2比纪念1难度小了很多，但是带来的视觉效果和感受都有很多不同。但是支持纪念碑谷，支持好游戏，不枉费我等了这么久01,vivo vivo Y67A,,,
所_Tの狗g,6497363,https://www.taptap.com/user/6497363,gender-empty,2017-11-07 08:38:46,,5,说实话5星给的是情怀分（当然，画风方面必定是巨棒的！），纪念碑谷2和1给我的感受区别太大，我手（脑）残在1会卡关半天过不了，但依然乐此不弃，但...2实在是太简单了，太简单了，太简单了！若不是情怀甚至让我觉得我这18块扔进了大海。同时，关卡方面完全不够玩，大概1.5小时通关。剧情方面有新构思，用“带小孩”的剧情让人眼前一亮...但总感觉根本没有1更能让我带入剧情。也许是老玩家对这一系列的游戏期待过高，所以有所失望，但我依然希望能够有更多的让玩家感兴趣的东西，也希望后续能加一些关卡，这金我也就给你氪了吧...腾讯登录那里不想说，自己体会(●―●),华为 荣耀畅玩5C,,,
加噶酱,3509303,https://www.taptap.com/user/3509303,gender-empty,2017-11-07 01:24:40,,4,通关达成   小情节很感人  设计的话每一关结束时自己设计图案样式的灵感很不错  创意延续了纪念碑谷1的思路  果树随阳光生长的想法很不错  不过没有碑谷1中八音盒那一关给我的震憾感了  顺便说一句那一关也是我最喜欢感觉创意最足的一关   总体说来很不错  期待继续出新不好的地方也说一下   不愧是腾讯买断的游戏  果然除了充钱还是充钱  在碑谷1中起码主线的10关不掏钱也能玩   付费可以玩附加项的地图   而碑谷2直接去除了附加项全是主线  从第三章之后直接需要付费  在这里只能给马哥打出一个666了,魅蓝E,,1,
我是托,9449854,https://www.taptap.com/user/9449854,gender-empty,2017-11-06 19:18:18,1小时49分钟,5,那时候一个晚上玩过了1代[包含艾达的梦]，这种视觉错位的益智游戏玩起来真的畅快淋漓。很期待第二代能给我新的惊喜。――――――――――――上线了！赶紧试玩！！――――――――――――通关留恋二代比一代多了些玩法，而且这种空间错位的脑洞更上一层，比如控制一代女主引导女儿，图腾身上开了传送门这样的玩法，为原本优秀的游戏模式设计上增添了许多乐趣。这18块钱花得很划算。,OPPO R7s,1,3,
手机用户10261700,10261700,https://www.taptap.com/user/10261700,female,2017-11-08 08:17:59,,4,全部通关了，来写个评价，音乐，玩法都是熟悉的味道，画面也很好看。但是太简单了，关卡太少，我仅仅花了2个小时就全通关了 ，而纪念碑谷1我花了2天多才在勉强通关，现在来玩，一点新鲜感都没有。再说剧情，说实话这种剧情不是特别戳我，我更喜欢1乌鸦公主的剧情，特别是与图腾柱分别的时候。以上理由就是我扣星点。总的来说纪念碑谷2是好游戏，但比起1来说，我真觉得不够好。,HUAWEI PRA-TL10,,,
赭鹎爱吃糖,2992939,https://www.taptap.com/user/2992939,female,2017-11-07 00:55:49,,5,和第一版一样！巨好玩7014*(290227t14s14022729)7914五星五星，不仅保留了之前的特色还更加好玩了(29612729ω61292729)游戏巨好玩，玩过的不要再犹豫了赶紧来下载(*7575*)没玩过的请吃下我这一口安利！！！吃了这口安利你不会上当(17ì _ í17)←坚定的眼神这款游戏主要是从立体的角度去分析物体( 0761灬61｀)还有一些不会or不可存在于现实生活中的立体图形ω主要考验的是你的思考能力和空间联想能力(924292)而且看评论说也不是特别难（说的跟我过了一样），这款游戏特别休闲益智，（*＾ワ＾*）绝对的休闲（修仙）游戏之一d(●0763｀●)17废话不多说快来下载吧～来下载吧～下载吧～载吧～吧［ps听说完整版还是需要购买的，也不是太贵吧十八元，微信的话也有打折(29`1151110729)］,,,1,
のだめ,14575058,https://www.taptap.com/user/14575058,gender-empty,2017-11-08 07:56:47,,5,游戏体验没有Ⅰ好，没有像Ⅰ通关后的成就感，也没有特别耳目一新的关卡设计，唯一增加的是根据光线伸缩的花，可是也没有运用到很多关卡里面。音效和画面不用说是特别地美，希望可以在关卡设计方面增加一些内容。五星鼓励一下79,,,,
亦,11437774,https://www.taptap.com/user/11437774,gender-empty,2017-11-08 07:42:04,,5,画面一如既往的美，但在关卡的设计上说并没有什么创新，并且，在一些关卡的设计显得一般，从总体上来说，纪念碑谷2更倾重于在叙述故事，比一代的更加显得整体。关卡结束后可以自由绘画“圣神几何”（笑）的设计很不错，但值得一提的是若想重新画一个必须再通关一次，这样很消磨对游戏的耐心。关卡数有些少，但还有增加的地方，期待后续会有更新。,小米 6,,,
小鲤鱼,8573874,https://www.taptap.com/user/8573874,gender-empty,2017-11-07 00:19:36,,4,首先，2和1比起来基本没什么改变，就相当于在1的基础上加了几张地图，也没什么新的有意思的玩法，挺失望。这种游戏本来就只能玩一遍，第二遍玩会很无聊，2除了一些细微的改动之外，玩法和1基本没有任何区别，还卖到那么贵……我觉得一碗拉面钱也是不值的。个人觉得游戏厂商应该多做一些新鲜感的东西吧，讲真，1的剧情就很烂了，全凭玩家脑补。其次，请“蔡康永”“饶雪漫”来翻译？？抱歉，我觉得和游戏的定位有很大差距吧，这种文艺范的游戏不应该找一些著名诗人来翻译吗？找一个娱乐主持人和一个写言情的翻译……抱歉我选择经典翻译。这种一遍过的游戏可玩性真的很差，和很多游戏比起来，逊色太多了，个人觉得除了信仰充值的群众外，买这个游戏，是不值的。,小米 6,,1,
海石fizz,7334146,https://www.taptap.com/user/7334146,gender-empty,2017-11-07 00:06:34,,5,一上线就下载安装了，已经通关。2的剧情有两条线，一是艾达的母亲萝尔，二是艾达的成长，但两条线的叙述并没有增加游戏本身和理解剧情的难度。不得不说，2的通关难度比1要小，可是本作的关卡和画面设计的比前作更为巧妙。 在大量诸如彭罗斯三角等不可能建筑的基础上，新增加了自我指涉的分形元素，很符合我的口味(最喜欢画家是埃舍尔~)。可能做着更希望把中心放在奇特的视觉体验和故事内容本身吧，不会因为过难导致游戏体验不够流畅甚至放弃。毕竟比起解谜的成就感，关卡和画面本身才是纪念碑谷最重要的元素。所以嘛，5星不怕骄傲。,,,1,
无法想象的时光,4525296,https://www.taptap.com/user/4525296,male,2017-11-06 23:35:17,,5,从游戏制作上来说比一代有所进步，精致感上更胜一筹。然而剧情和解密上嘛，剧情这次主打亲子、成长、传承等，相比起来一代的寻找自我、救赎等更适合纪念碑谷这种游戏，剧情上优点卖情怀；解密上就更差了，虽然可以感受到工作人员的努力，但和一代比起来设计的就差出档次去了，我至今还能回想起一代各式各样的翻转和方向，这代在这种难点上非常少，剩下的难度根本不值一提。。。总体来说游戏还是可以给5分的，只是这代是能给5分，一代是最高只有5分,Xiaomi MIX 2,,1,
手机用户11636465,11636465,https://www.taptap.com/user/11636465,gender-empty,2017-11-07 23:11:01,,5,延续了第一部的风格，难度相比第一部不是降低了，而是因为多样化元素加入所以使难度表面上看上去变低了，但是更富有创意性。并且亲情本身就是很好的一个体裁，陪伴着萝尔从一个依赖妈妈的小女孩变成了可以独自解决问题的人，就好像自己经历了成长的过程，大概这是每一个漂泊在外的学生都难以释怀的情节吧。所以我认为还是值得一玩的,华为Mate 9 pro,,1,
Ryzen,5534816,https://www.taptap.com/user/5534816,gender-empty,2017-11-06 22:33:32,,4,凌晨守了一会儿没啥动静下午看完电影出来发现发布了于是开着流量就安装好迫不及待的开玩觉得难度是比一代低了好多好多一开始以为是前几章的原因所以简单 可惜到后面也一直没什么起色 所以一星扣在了这里_(:зf∠)_sorry画面和配乐都是一流的这点没啥可说啦最后还特意看了一下音效设计师的名字 是Todd Baker （手动比心(@07A*)79还有小红帽（哈哈哈官方没给名字呀就是觉得很像啦）走路的时候蹦蹦跳跳的好可爱啊！后面几章小红帽长大了好多！！指给同学看说这个是孩子的时候连我自己都诧异了一下哈哈哈哈哈一不留神就长这么大了呢51(@40A*)（妈妈心）最后还是期望能再更新啦十四章根本不够玩嘛！_(:зf∠)_,华为 荣耀Note 8,,1,
伞,3570845,https://www.taptap.com/user/3570845,gender-empty,2017-11-07 22:14:45,,5,以前你们说什么这游戏做的这么好居然免费，现在它连着1的钱一起收你们还不乐意了。别跟我说什么游戏难度第了，它为什么会这样你们心里没点b数?你们说这游戏谁代理的？明白了吧，那还不快打出你们的五星，和我一起gtmd腾讯,GIONEE GIONEE S10C,,1,
兜兜里藏糖的猫,5355110,https://www.taptap.com/user/5355110,gender-empty,2017-11-08 04:54:42,,5,很开心在生日当天收到游戏正式上线提示，第一时间就下了，昨天没时间玩于是熬夜游戏通关了，大都能明显感受到的是游戏难度下降了，亲子之间的互动还是很暖的，能自己画通关图腾挺有趣的，我最喜欢树的那一关，很漂亮，最后暗变亮的地方挺惊艳的。,,,,
72樱井凌沫72,5632405,https://www.taptap.com/user/5632405,gender-empty,2017-11-07 21:24:13,,5,当初玩一代的时候可是连教学关都啃了半天的我，硬是花了两天时间才把游戏通关。怎么说，游戏方式很新颖，玩的时候就眼前一亮，有时候连怎么通关的都是一脸懵逼，反正转着转着，就过关了......智商有限没办法哇(*6328636329)游戏出二代真的让人很期待，一代剧情治愈又致郁，最适合我这种多愁善感的人玩了，总是能脑补出好多好多剧情。别的不说了，大爱！！,,,1,
软萌什么的……才不是呢,7581556,https://www.taptap.com/user/7581556,gender-empty,2017-11-07 14:06:00,,4,本以为小公主会再次前行或许是她累了吧想休息了吧……看到游戏名，果断五星只是或许是我审美疲劳了吧再也感受不到当初的感动了游戏不错，无论是画质，玩法，还是难度，剧情，都应该极好最后还是扣一颗星，抱歉，我累了（完）,,,2,
Hank Zang,91242,https://www.taptap.com/user/91242,male,2017-11-08 04:26:11,,5,从这款游戏一出来我便下载了，然后认认真真的享受着每一关，当全部通关完后就一直在等待第二部，也就是这一部了，从安卓版刚发布当天，就毫不犹豫的买了，然后花了点时间通关了，感觉两部都超级喜欢，不管是视觉还是音效，所以我给5星好评，希望以后作者能给玩家带来更好的游戏,三星 Galaxy S6 edge+,,,
幻星,2974519,https://www.taptap.com/user/2974519,gender-empty,2017-11-07 13:48:33,,4,"收到短信立马滚了过来然而，贵，而且关卡少，也没啥新东西，2小时不到就通关了，比起第一部层出不穷让人头晕的套路，第二部大概就只剩套路了剧情……第一部各种感动，第二部……师生情？或者是母女情？就跟写作文没东西可写的时候强行感动一波一样""哭，都给我哭！(25ω25 )(25ω25 )”还有一些挑刺的毛病:1.披风好难看啊2.第十章(植物园)背景音里面“哒哒哒哒哒哒哒哒哒哒哒哒哒哒哒哒……”",ZUK ZUK Z2151,,2,
spica,15424582,https://www.taptap.com/user/15424582,male,2017-11-07 13:42:03,,4,没法给满星，真的流程短小，剧情模糊【虽然一代也模糊】，新元素不多，只有光线树和同事操作两个人，并且大部分关卡设计的无脑，转转圈点点点就能过，作为一部神作的续作实在是大打折扣让人觉得这价格不值得，就当是给第一部一起补票了吧如果dlc能让我改观的话再说5星的事吧,Xiaomi MI MAX 2,,2,
apblkp,12237544,https://www.taptap.com/user/12237544,gender-empty,2017-11-13 23:11:49,,5,不知道为什么会有那么多人因为要钱就差评，本来就是付费游戏，第一部也是付费，张口闭口要免费，腾讯代理的中国区全球最低价，Googleplay上都要30多，再说凭什么免费给你玩，你又没参与游戏制作，你是想白嫖吗，我觉得开发者可不会给你们这些用盗版用习惯的低保户做公益,iPod touch (6th Gen),,1,
残喘92,4092922,https://www.taptap.com/user/4092922,male,2017-11-07 13:30:15,2分钟,5,比一更暖心，母女之间的互动，让人更为感动，游戏还是采用几何来挑战我们视觉，本人已经玩了两关，真心好玩(2961 . 6129)，虽说是被腾讯代理了，但腾讯还是能控制住自己的，没在里面植入什么氪金之类的东西，只是让支付简单了点，可以微信支付，qq支付，如果说腾讯在里面加了氪金项目，等于毁了这款游戏，如果这样，我宁愿去玩一。,Meizu M6 Note,,2,
草佑_,4541819,https://www.taptap.com/user/4541819,female,2017-11-12 08:38:13,14分钟,4,比起一代，二代真的超简单啊！但是BGM和剧情还是秒杀一代，扣一星给难度,,,6,
大魔王趴趴,4803163,https://www.taptap.com/user/4803163,female,2017-11-07 20:34:13,,5,期待了很久的新作，结果打开评论，前几条就是说没有第一部好玩，难度下降了，当时真的有点担心害怕自己会失望结果玩完以后发现自己完全多虑了(所以好不好不要听别人讲，自己试试才知道)，相比第一部孤寂，冷色调的主线，第二部更偏向于暖色调，主题围绕亲情展开，画风更加唯美，尤其bgm比1好听多了，全程耳机舍不得摘下来2333～对于许多玩家说2没有1好，我不赞同，不过萝卜青菜各有所爱，好不好还是自己玩玩才知道～,OPPO OPPO R11,,1,
盼君归来期,6185776,https://www.taptap.com/user/6185776,gender-empty,2017-11-07 10:51:13,,4,真的是期待了很久，等了很久。但是说实话，2下载玩过之后，初体验觉得并不好。我的确不喜欢腾讯，但是对游戏的评价与对腾讯的偏见无关 。首先是每个人都关注的付费问题，纪念碑谷1免费章节全通关之后，我二话没说就买了游戏。但是，2没有给我这个欲望。只有小三关，立刻需要付费，瞬间给我一种，这游戏怎么到了腾讯手里就变成迷之氪金游戏了？三关真的完全没体验出游戏质感如何，虽然是游戏老粉，知道游戏很良心，但是，我相信游戏却不能完全相信腾讯。很重要的一点，纪念碑谷1很清晰的告诉玩家，你所有的付费金额将买到多少章节多少东西，心里是有底的。但是2全然没有任何相关字眼，只告诉你，打折了18块，买了就解锁，综合游戏初体验，不想买。接着，游戏内容，对比1来说目前感觉最大革新就是关卡最后体验还不错。更换了不同的剧情，画风整体比1偏暗。虽然只玩了三关，这也就是整体体验了，看了论坛说:制作人员也要吃饭，花钱买个正版游戏没什么，相关言论也不少。因为腾讯就无脑喷的确实过分，想为正版游戏花钱也没什么，但是游戏体验是自己的，没有体验的花钱也浪费的。这个游戏对路人粉或者初见游戏的来说，感觉真的不值得购买。,OPPO OPPO R11 Plus,,,1
星空.无悔,16111072,https://www.taptap.com/user/16111072,gender-empty,2017-11-16 20:07:18,,4,剧情感人，画风唯美，锻炼思维推荐玩,OPPO R9,,1,
Yukina,2815217,https://www.taptap.com/user/2815217,female,2017-11-16 19:36:17,,5,很棒的游戏，已经通关，母亲和孩子的故事会打动每一个人。,小米 6,,1,
墨竹轮回,3422069,https://www.taptap.com/user/3422069,gender-empty,2017-11-07 19:31:10,,5,没有说不值的感觉，毕竟我也是花了三十玩儿了正版一的人……就是，感觉好短哦……要是再长点就好了……前前后后大概花了一个多小时吧，比起一来说短了不少，也少了当初那么酣畅淋漓的解谜感，大概是从烧脑解谜游戏变成了轻解谜故事游戏，大概也算是补全了世界观?一个关于成长与旅程的双线故事，新加入的元素也特别让人惊艳，总而言之，还算是不错(29＞11＜)☆,华为Mate 9,,1,
弹吉他的碎娃,3438020,https://www.taptap.com/user/3438020,male,2017-11-17 02:42:04,,5,画风依旧好 但从一开始就觉得难度系数有点儿低,小米MIX,,,
帅比,5511721,https://www.taptap.com/user/5511721,male,2017-11-07 12:07:09,,4,说一下吧，这个游戏的游戏体验没的说，能看到制作组满满的诚意，但是有一个很大的问题，就是它在中国的售价与它的游戏寿命不成正比。不得不说2给玩家的感受就是游戏很短，不值这个价。这个游戏售价4美刀，但我们都知道中国和美国的消费水平是不一样的。我知道价格已经是既定的事实，所以制作组现在能做的也就是希望制作组能为2做好它的dlc，真正让玩家觉得物有所值。,三星 Galaxy Note5,,2,
水镜凌轩,1295488,https://www.taptap.com/user/1295488,gender-empty,2017-11-06 18:37:19,,5,画面还是一如既往的美wwww因为是学生党上课偷玩所以没有开音乐无法评价音乐，大概一个小时左右的游戏时间想说太短啦！希望可以出dlc吧。相比一来说:有点小贵，难度没有太大。emmmm中文有三个版本的翻译，每个都很好，英文没有看。下载之后需要登录账号，qq或者微信，之后的购买游戏是记录在登录的账号上的。不要觉得腾讯代理就嫌弃啊_(:зf∠)_跟腾讯丝毫没有关系啊而且充钱也不能变得更强233333故事讲的（个人理解）大概是一个妈妈和一个女儿的故事，女儿最后长大了，分离又重聚，大概是这样吧。等待了这么久没有辜负期望w五分差评,,,1,
Deadpool,6469561,https://www.taptap.com/user/6469561,gender-empty,2017-11-07 11:13:19,,4,我是在高中时候玩了纪念碑谷1，那时给了我极大的震撼。等第二部纪念碑谷等了很久，昨天晚上被通知上架以后就立即下了。在通关之后，有些小失望，关卡太少，价格和游戏时间有点不配，希望以后能继续更新。相比于第一部，第二部少了第一部的红海和星空那种让人眼前一亮的场景，让我印象深刻的只有随阳光生长的方块数。喜欢这部游戏，也希望她能越走越远,华为Mate 9,,2,
入袋成盒,3357906,https://www.taptap.com/user/3357906,male,2017-11-07 01:30:00,,5,所以这是怎么回事？怎么一上线就和《纪念碑谷2》第一部拉开0.7分？99_99?是第二部谦虚了？还是玩家都拿起刀了？游戏完全不是狗尾续貂，就算你说没了当年那种震撼，但是五星是完全可以给创意满满的脑洞的不对，这应该是：因为有人不喜欢看这腾讯登录？或者是付费章节在腾讯登陆的游戏里面水黑对此感到“恶心”了？嗯，我能理解，这就好像：在一碗海鲜拉面里面看见虾不是虾而是北方蟑螂、泡面吃腻想下馆子的你只吃到了冷饭团………………对腾讯印象为何停留在这样杯弓蛇影的地方。哪有被黑的那样恶心（WC居然真的有一天我们会在《纪念碑谷》的评论区发现水黑）,华为 荣耀畅玩6X,,1,1
陈陈陈陈,2703887,https://www.taptap.com/user/2703887,gender-empty,2017-11-06 18:04:24,,4,希望越大失望越大？？一的盗版玩了两三次，然后看到2出的消息，就一直期待着补个票？今天第一时间下载和买了全部章节，然后总体感觉emmmmmm……四星！！！！故事情节、音效、画面和玩法创新依然无法挑剔，例如光线和植物配合那章的玩法就很nice、、、但是难度实在是太太太太太简单了，虽然官方初衷是利于更多人参与到游戏乐趣之中，，，可是个人觉得忽略了老用户的粘性，估计包括我在内的很多玩家最多只会玩三次，为什么？体验三种文字故事，，如若不然就会一次弃了，等后期更新。。。希望官方下次更新，稍微提升下难度，或者出简单和困难两种游戏模式供玩家选择。。。情怀大家都给满了，今后望官方给一个耐玩的游戏给大家。。。ps:希望腾讯大佬代理就代理，千万别插手这游戏任何内容，标点符号都不要增减一个！！！！！如果后期二次付费的话，mmp我就直接讲了,魅族 Pro 6,,1,
卷卷音,14174830,https://www.taptap.com/user/14174830,female,2017-11-07 17:31:01,,4,刚刚第一次通关，我就来写评论了，画面仍然精致，但是我还是感到1更梦幻，可能是主题的不同?玩完后，第一感觉是，真的，真的，好短，一个小时左右就通关了，解密上更简单了，没有什么太大难题，直到结局的时候有一种该如此，但又想要再继续的念头，总的来说，我认为2没有1耐玩。最后弱弱的问一句，会有追加的dlc吗?,,,1,
白痴公子,9698347,https://www.taptap.com/user/9698347,gender-empty,2017-11-06 17:27:36,,5,下了之后很快就通关啦～画面还是超棒，最后的几何结构是可以自己决定的，最喜欢的是运用阳光的那段还有神圣之门，一个是玩法新颖一个是视觉效果震撼。还有当然就是有图腾的哪一章，图腾真是太可爱了，被踩到眼镜还会叫。。。可怜萌。比起一代来似乎简单了不少？虽然场景还是比较多，但是其实没有太多操作。双人玩法和上一代差不多，只是把图腾换成了人。其实我觉得第七章高塔中间有一段平面与立体的切换很有意思，但是好像只是展示了下，并没有发掘出特别的玩法。,小米5S,,1,
我不是我没有我不可爱QAQ,968762,https://www.taptap.com/user/968762,female,2017-11-06 17:18:28,,4,一小时(可能更少)微信下载版本通关撒fa~创意不减难度不增的好续作，解密相比前作的确有点简单，但配色跟音乐真的很赞，多种版本的汉化风格也十分优美(又有句子可以拿出去装B了不不不这句划掉)，诸如踩图腾眼睛时图腾会带着声效闭眼之类的细节也能看得出十分用心，就是帽子从四次元姨妈巾里掏出来有点心大(V_V)。长吁口气的说，还好腾讯没有毁掉这个游戏，从比较贴心的角度来讲，账号登录可以让因为内存不够删掉而日后再下的人(比如我)不会尴尬的重玩一遍才能回味想要的关卡，个人感觉腾讯这一次还是挺可爱的。可是我还是想看到艾达和黄图腾跟乌鸦人继续历险啊QAQ，为什么不做一个长大后的艾达或者萝尔的女儿艾达，而是选择做一对新人物呢感觉很不满足呜啊啊啊。。。说好6号上架结果凌晨没上架害很多人白等还可以归咎于准确上架时间未公布所以双方都不背锅，但你发帖说下午两点上架结果也没上架，不出来解释原因也不出来道歉。。。我从凌晨零点等到一点多，九点醒了等到下午三点，后来还是在微信拿到游戏，TapTap这里除了弧我屁事都没干。不管诚信这锅你们背不背，厂商这一星我扣了，说的难听点，你们活该m9。――来自一名被欺骗感觉心很痛的谷一(滑稽)铁粉,三星 Galaxy Mega 2,,1,
睿 妍,2695906,https://www.taptap.com/user/2695906,gender-empty,2017-11-08 00:21:34,,5,从1到2，游戏难度降低了，但是画面和故事仍然完美，我是这款游戏的忠实粉丝，这样高品质的游戏，我很喜欢，要是关卡能多些再多些就好了，今天下载，今天就通关了，感觉好失落啊~，什么时候出3？着急啊！不知道有没有类似玩法的其他游戏来填补我的空闲时间~,OPPO R7s,,,
觋夕莉,10433817,https://www.taptap.com/user/10433817,gender-empty,2017-11-17 00:14:24,,5,从一代接触到这游戏我才知道原来手机游戏能做到这种境界我觉得最好的手机游戏,小米 6,1,,
