user_name,user_id,web,sex,time,play_time,score,comment,phone,huanle,dianzan,dianxia
Florine,3208375,https://www.taptap.com/user/3208375,female,2017-11-17 08:07:50,12分钟,5,纪念碑谷真的是神作中的神作，不管是1还是2，在画质上创意上剧情上都能惊艳到我。真的要给制作团队点很多很多赞啊！虽然2比1玩着简单很多，但是人家开发的时候脑细胞耗费的肯定不比1少啊！一开始以为是母女俩一直一起走到终点的，居然猝不及防地分开了...接着母亲的世界就灰暗了，这点感触好深啊...最后一关的日月交替，很像现在的我跟妈妈，我在法国，妈妈在国内，7小时的时差，所以也非常非常有代入感啊...最最让我惊艳的是果园啊，女儿长大就像是绽放的花朵，太太太美了！看过很多类似的游戏，个人觉得真的没有碑谷如此惊艳。总之值得买值得玩！,三星 Galaxy S6 edge,2,33,5
白莱菌,316712,https://www.taptap.com/user/316712,male,2017-11-15 16:31:16,5分钟,5,除了游戏难度以外，不输纪念碑谷1的游戏，最后的画面让人欣慰而感动，五星好评。纪念碑谷1：山穷水复疑无路，柳暗花明又一村纪念碑谷2：条条大路通罗马虽然这么说，但个人觉得，难度并不足以使这款游戏减分，本来看评论都说简单我也没报太大期望去玩，玩的途中一直很烦躁，一路顺畅到怀疑游戏的价值，直到中途剧情转折时，我的注意力才完全被剧情拉了过去，我想知道接下来的发展，这是1所没有带给我的体验。直白的说，1所吸引我的是它的设定与难度，以及通关过后的成就感。而2通关则是沉浸于剧情所带给我的小小的，温馨的，持久的感动吧。,红米Note 4X,31,168,26
鎏天韶华7115,15226001,https://www.taptap.com/user/15226001,female,2017-11-14 12:43:13,4分钟,5,确实比1要简单很多，对于空间想象能力技能点满的我来说，这和几何学一样完全就是平推……一共花了差不多40分钟多一点就通关了，并且大部分时间浪费在了通过小关卡后的画画上……总想画个特别漂亮的花花……个人印象最深的就是第二章母女两个人猝不及防分开的那里，一开始玩的时候并没有做过什么功课看什么ios已经玩过的测评，优哉游哉的点击人物移动的时候并没有想过会发生这种突发状况，一下子两个角色分开，就像自己小时候一时半刻见不到自己熟悉的人就会感到不安，特别有感触。那一瞬间无法控制游戏，不能用手机控制建筑的下降，不能阻止将要发生的一切，也不知道在倾倒的建筑上的母亲会不会甩出去 ，会不会受伤――那一瞬间我们无能为力，并且深深的痛恨着自己的无能。也就是那一刻，玩家进入了游戏世界。还有就是中间有一章，打开两边的窗户放进阳光，女儿从一颗大树的顶端绽放――真的是绽放，还有花瓣――那一瞬间就像我们长大了，成人了，从这一章之后，母亲出现后模式几乎都是女儿先走――照顾与被照顾在绽放的一瞬间，就翻转了。看到她们，就像看到过去的自己，是怎么一路走过来的。纪念碑谷的人物角色还有地图在设计上非常精细，每次转折点两位主人公回头、注视、慌乱、舒心、放手、重逢……用简简单单的画面把复杂的情绪刻画得比真人电影拍摄还生动，地图中出现的树也是具有代表意义的一个象征画面，随着阳光而变，向阳而生，向死而活，成长自己，最后也要成为一个母亲，将新生托举至阳光。,三星 Galaxy S4,22,90,38
太二酱,8067223,https://www.taptap.com/user/8067223,gender-empty,2017-11-17 18:05:07,1小时40分钟,5,依旧是唯美的画风和视觉差。个人原因并没有觉得难度上的一些感受。剧情也是设置的不负众望。玩过1，所以对于2的期待其实还是很高的。本作中其实个人还是比较喜欢自绘图案和双子操作的，分分合合，还有与图腾的重逢都是自己很喜欢的地方，值得一玩。,红米Note 3,,2,
周朝的矮个巨人,398164,https://www.taptap.com/user/398164,female,2017-11-15 12:57:57,59分钟,5,本打算等到热度都过了才慢慢来玩，结果发现它久热不衰啊哈哈哈～比起第一部，关数比较少，玩的不过瘾，但不知为何感触更深。画面精美，BGM优美，音效很好（最喜欢脚步声了）这整个游戏最喜欢的就是最后面那个随意变换形状的了，真的很喜欢。,荣耀畅玩6X,,12,3
嗷呜,15641335,https://www.taptap.com/user/15641335,female,2017-11-15 22:25:16,24分钟,4,第二部，首先画面和音效比第一部感觉要好，脚步声比第一部更有感觉，更真实贴近游戏，以及最后结束时的自己绘图很棒，其次就是我听说的游戏难度，之前看过一个很中肯的评价说，不是变简单了，只是比起第一部带给我们的惊喜少了，游戏玩法没有什么太多变化，我也觉得是这样。这一部里，后面用光影响树叶生长的这部分，我感觉就很有意思，很有创意，同样我很喜欢的还有积木（暂且这么叫吧98）的嫁接转移，通过转移接触来创造前进的道路，很是让人喜欢的玩法。总而言之，比起第一部带来的惊喜，我感觉更多的是一个游戏的延续，新创意和亮点还是少了点，但是还是很棒，毕竟想新点子也很难～(￣￣～)~希望还能继续出下去～,华为 荣耀7,,6,2
想回谷的咸鱼君X的替身,2471041,https://www.taptap.com/user/2471041,gender-empty,2017-11-13 22:06:43,24分钟,5,[剧透注意？]↓↓↓↓↓↓↓当我玩到小人乘船离开的时候，心里感触很深……因为不晓得究竟是不是应该这样理解。但是――我是因为我这样想着，受到了触动。所以……就，随便写写这样的印象。曾经是大人带着孩子走向远方大人的步伐牵动着孩子的脚步孩子是大人的倒影后来孩子渐渐成长勇气逐渐成为孩子的力量大人独自坐在塔上歌唱孩子不再是稚嫩的彷徨换过来是孩子寻觅大人的方向后来的后来孩子坐上了小小的船扬起了小小的帆大人与孩子分别的时候花瓣像是船月亮落下了光亮,华为P10 Plus,8,51,10
卷毛呆呆,3975335,https://www.taptap.com/user/3975335,gender-empty,2017-11-13 20:11:20,8分钟,4,刚出第二天买的，刚刚才通关，emmmmmm……八分钟通关？感觉二代没一代这么烧脑了，简单了很多，在玩过一代的情况下，个人认为是不如一代的，所以24块有点贵了(89_89)希望能出扩展，或者出3能更有心意一些，这里给予四分表示并不过分～（严厉点才会有更好的续作∠( 31 」∠)＿）,三星 Galaxy C5,2,20,7
活着的风,2038617,https://www.taptap.com/user/2038617,gender-empty,2017-11-12 19:34:16,1小时22分钟,5,确确实实是不错的游戏，画面音乐没得说，剧情线较前作更为清晰。惊艳感的话确实有些不如前作，毕竟是同样的风格体系，加上前作神级，实在难以超越，能保持水平就是不错的发挥了。难度较前作有所降低，这个调整不太好评价，有优有劣吧。好处是不会卡关，能更好的融入小女孩的成长之旅中。但对于期待烧脑的玩家，就有点失望了。再就是剧情，二代主线很明确，成长。从懵懵懂懂只会跟在母亲身后的女孩，到独当一面，挑起全族重担之人。整体的画面音乐，都有一种明快，新生，成长的感觉。阳光，树木，都是颇有主线特色的亮点。但同时，太明显的主线也成为了一定的限制。比起一代，少了些东西。相反一代虽以救赎为主线，但仅仅是主线关卡画面音乐中透出的若有若无的孤寂，忧伤，顶多加上幽灵几句晦涩的讽刺和挖苦。直至最后才透露的答案。确确实实给了当年的我一份震撼。还有艾达的梦那几个关卡，有宁静，有荒诞，有治愈，也有致郁。虽无关主线，但也确确实实吸引了我。也不是说怎样，二代同样是成功的手游。只能说一代太过成功，玩家对二代抱了太大期待，却不免有些失望。当然，还是希望制作组能有些后续的更新。哪怕是彩蛋，都是值得高兴的。最后，是想说说某些看见腾讯代理，看见要花钱就跳脚的人。这部游戏，我认为代理的是很成功的，没有乱加什么签到，广告，内购礼包。干干净净的给了你一个纪念碑谷（反面例子详见瘟疫公司，好好的毁灭世界黑色幽默的游戏，愣是被代理商搞出页游风格。无语）。唯一有腾讯影子的，也就是个QQ登录而已。当时活动期间18后来24，真不算贵了。在其他手游里，这连月卡都买不了一张好吧。说别人土豪，说腾讯吃相难看的。我只能说，国人真的是盗版产品用多了。能随随便便氪个v11，却不愿意买个正版产品。有些东西，有些想法，真的得改改了。,华为荣耀7,12,90,17
菡舍,511563,https://www.taptap.com/user/511563,male,2017-11-17 16:42:18,,5,国际版售价4.99美元，先给钱后玩，腾讯只收了25rmb（折扣18）还让你先玩三关，这坑？登陆？云挡不要了吗？谷歌上还不是要登陆谷歌账号，难度是低了不少，关卡也少（第一部刚出的时候才十关，剩下的都是后续加的，说不定二还要更新），亲子？我只看到了几句鸡汤，什么是亲子你自己不知道吗？要个游戏告诉你?我觉得这游戏好我愿意买，玩一的时候没钱，现在有钱了我就是买，我就是给五星，怎么了？觉得腾讯不好先把QQ微信给我卸载了，QQ会员是逼着你开的？腾讯游戏是逼着你玩的？,LGE LGLS992,,3,
额嘞,362393,https://www.taptap.com/user/362393,gender-empty,2017-11-15 18:21:43,52分钟,5,今天终于把它玩完了，之前都不太舍得玩，其实也不是特别难，但是就是觉得很有意思，喜欢那个用阳光控制那个盆栽的那块，虽然花了钱，但是觉得也算值，挺喜欢的，还会不会有纪念碑谷3啊，或者出vr版90毕竟自己学vr就还挺期待,OPPO R9,,5,3
墨隐哀,336648,https://www.taptap.com/user/336648,female,2017-11-11 23:53:52,1小时6分钟,4,emmmmm开放下载半个小时左右就下载了。挺激动的，毕竟等了几个月了。然后断断续续打通了，放了好几天才来评论诶嘿。画风和音乐都跟第一部一样棒。emmmm比起第一部多了一些新的元素，图腾变了个色什么的hh还有后面那个盆栽和那个啥图标特别嗯有点小惊喜hhh嗯感觉解谜元素没有第一季那么多，基本不怎么需要思考，基本课间十分钟就能玩过一关hh然后看了下TapTap记录的游戏时间也才一个小时，比起第一部简单太多，感觉有点小缺憾吧。还有虽然是秒购入手的，但是据其他小伙伴说好像只能玩一点就要买了emmmm不知道怎么评价吧，但是还是希望就算不买也能有第一部那样稍微好一点的游戏体验吧，不然感觉还没开始喜欢上就已经没了。emmmm这一部主要还是玩的情怀吧，没有太多新元素的加入，还有就是太短了感觉不过瘾啊嘿嘿总之还是支持的啦w玩还是值得一玩的～好了我要去再刷一遍了嘿嘿边玩边截图,金立 大金钢,21,104,47
裤裆里的小怪兽,6008783,https://www.taptap.com/user/6008783,male,2017-11-11 18:26:11,2分钟,4,【依偎与成长，创意与美学的续作】长评：①《纪念碑谷2》与前作沿用了前作的低多边形（low-poly）扁平风和艺术表现形式――经典的视觉错位、矛盾空间等。游戏流程比前作缩短了许多，正常通关全章节只需要1～2个小时，而且难度系数不敌前作。②本作在前作的基础上，增加了不同的画面表现玩法，如章末尾声的自定义万花筒、无尽轮回的几何空间、遇阳而生的成长树等。在一些游戏章节的场景中，能看到许多绚丽的颜色，因为作者用一两种颜色或渡两种反差大的颜色，使整体画面不会显得杂乱，不仅很好地把握种类不同的彩色，而且萝尔送走女儿后的黑白灰场景中也是运用自如，强化了整体的画面表现力，带来的视觉冲击感更加强烈。③剧情内容上，这次旅程的主角从艾达公主变成萝尔母女二人。故事也从艾达归还几何的救赎之旅，变成萝尔带着女儿探索神圣几何奥秘的世界，主题上从救赎与羁绊变成依偎与成长。整个剧情中小女孩从一开始依偎在母亲身边，再到独自驾起一艘小木帆乘风破浪，然后与母亲重合，最后登上神圣几何的桂冠宝座，无时无刻不在体现那伟大又微妙的情感――母爱。母亲萝尔在送走女儿后陷入了迷茫，随后寻找旧友，找到了自己的答案。02④由于评论篇幅不宜过长，我写了一篇完整的图文版帖子，感兴趣的小伙伴可以看看。https://www.taptap.com/topic/1706107,华为荣耀8,10,54,31
仇厌,10450853,https://www.taptap.com/user/10450853,female,2017-11-16 01:14:12,3小时36分钟,5,玩得很开心 有感到亲情的温柔温暖比起前作难度地了不少 也是我能通关的原因【心虚每一次短暂分别后的拥抱都觉得很温暖很开心最后的画花纹也好好玩（*07``*)～78在游戏结尾看到自己画的花纹球像神迹一样落下来太感动了我们引导角色 角色信仰崇尚我们译文也很有人生道理233333反正拿几个小时的人生来玩真的不亏！会让人觉得舒服的游戏！,vivo Y923,,,1
未霞，,7434201,https://www.taptap.com/user/7434201,female,2017-11-11 10:26:59,26分钟,4,表示与一代相比二代的关卡简单得多了喵，基本上都是转一转，按几个按钮就可以了喵_(з」∠)_没有什么太大的新意啊喵，至少在前三章是这样_(з」∠)_不过呢画风却没有什么太大的改变，简单清新，但是在细节上与一代相比起来略微有着改进呢喵(0711ω11`)还有就是第二章还是第三章来着，滑坡那一段做得很好的喵！虽然把本喵吓得不轻呢(sF□′)s喋擤ォ咄娣ㄊ裁吹模与一代相比没有什么区别啦，依旧是一个解谜游戏，有时看似过不去的地方，只要认真观察，合理利用机关这些的，便会“山重水复疑无路，柳暗花明又一村”呢喵r(F′)q最后就是小萝莉蹦蹦跳跳的样子感觉超可爱呢喵！(*/ω＼*),OPPO A33,58,203,87
ゲゲケ,64135,https://www.taptap.com/user/64135,gender-empty,2017-11-16 12:39:13,,5,在玩的过程中真的是无脑截图(296106906107)1277手机里一堆，每张都可以是屏保(296106906107)1277超爱(296106906107)1277每一章的最后可以自己来画完结图，真的好喜欢呀(296106906107)1277超级满足少女心(296106906107)1277钱花的也超值(296106906107)1277想再玩一遍(296106906107)1277好喜欢好喜欢(296106906107)1277疯狂卖安利给室友(296106906107)1277已经找不到更多的词汇来形容对它的喜欢了(296106906107)1277满分100分，我给1亿分(296106906107)1277期待3(296106906107)1277从把游戏下下来，断断续续的玩，刚刚终于通关了，然后第一时间来写评论(296106906107)1277,华为荣耀V9,,3,
ilaiceroY灵,1000730,https://www.taptap.com/user/1000730,gender-empty,2017-11-15 02:53:03,1小时18分钟,5,纪念碑谷二，虽然关卡难度没有一代高，但游戏整体可玩性并不比一代差，在每个关卡结束后，碑谷的关卡图腾由原版设计好的图腾，改变成玩家自己选择设计碑谷图腾，新奇的创意十分有趣。嘛～希望二代可以出一些番外关卡吧。,,,1,
boy next door,9645448,https://www.taptap.com/user/9645448,gender-empty,2017-11-17 12:01:07,,5,很期待以后的新关卡更新（小暖图腾出境好少呀哇哇哇）。纪念碑谷2最棒的创意是两条剧情线，最后一关可以操作两个人，你不得不惊叹设计者的技术和脑洞。开始几关确实简单，算是新手入门吧，后面就有一定挑战性。剧情方面很多热评都说啦，很精彩，让我回忆起小时候和母亲的点点滴滴。总之，纪念碑谷2带给我们视觉的盛宴和心灵的感动，珍惜身边人！,小米5S Plus,,3,
LITRCA,4805775,https://www.taptap.com/user/4805775,male,2017-11-12 10:04:09,49分钟,5,相比于第一作，纪念碑谷2的剧情线更清晰了，感情表达也更丰富了。但因为整体没有加入太多的游戏新套路，不免让老玩家有些失望。有人说难度相较于上一部下降了，其实正是因为没有加入太多的新套路，使得玩过第一部的玩家很容易就能通关。总的来说，第二部的评价不如第一部的原因主要是因为第一部带来了“惊喜感”，这使得它在这方面加分。很多游戏都面临着第二部反响不如第一部的问题。另外第一部连被遗忘的海岸和艾达的梦都19个关卡了，价格都比第二部的14个关卡便宜，第二部在第一部的基础上也没有什么质的飞跃，这样的价格实在有点难以接受。总之求USTWO考虑考虑再做几关07（这段是后加的：其实说没有什么新创意也不对，果园、眠海之城等等地方也是有很多新玩法的，只是主要玩法不变，说第二部没有创新实在是有点为难官方。另外中国区的价格的确是全球最低，这点我是之前没有注意到的。原价24，我趁打折时用微信只花了17.10，腾讯在这一点上还是很良心的。不出新关卡也值了，如果出的话我也不介意27ω27）───────────────────论全游戏最让我感动的地方就是植物园结尾了，萝尔给孩子送去祝福的画面，萝尔仰望的天空变成孩子行驶的海洋，这个创意真的很棒。其次就是在远日点图腾被唤醒的时候了，另外萝尔踩到图腾眼睛的时候图腾还会把眼镜闭起来，真的好萌啊_(:3」∠)_───────────────────再次求USTWO多来几关，正如萝尔的母亲所说：山谷中的幽灵一日不能安宁，纪念碑谷的故事就一日不会完结（这段是后加的：好像萝尔母亲说的和这个不一样，总之是这个意思就对了）,vivo X5M,23,172,35
孤屿,531055,https://www.taptap.com/user/531055,female,2017-11-12 18:01:44,1小时22分钟,4,玩完了。相比一代差好多，因为一代想入的慎重-首先是游戏时长，真的是每一关都非常短，两三张图就没了，打通关也就两个晚上，还是学生党没多少时间玩的情况下其次游戏难度，相比一代简单太多，基本都不需要动脑子(。)随便转转就能过了操作和关卡都没什么创新，除了阳光与果树及后面几关转平台的之外，感觉基本全都是一代了，完全没有眼前一亮的感觉-平均一个关卡五分钟左右？还有些关卡看完剧情就没了emm-价格偏贵，不知道和tx代理有没有关系，对比一代，二不仅短小还贵出那么多。还是说钱全在翻译费上了？？但如果是一代这个价，我个人完全可以接受。-可能这代游戏侧重点在亲子互动向上吧，反正我一个解密玩家挺失望的，光卖情怀远远不够啊-主题方面一代侧重点个人理解在于忏悔与拯救吧，偷走了神圣几何的小公主，经亡灵(？)指点选择了忏悔，选择归还神圣几何，也遇见了朋友，最终得到一个美好的结局二代的话侧重亲情咯？立意没有比一代令人印象深刻吧。母亲和孩子，关于爱与成长，其实也是很温暖的主题，但是相比较差距挺大-画面和bgm还是没得挑，都很不错-看到有评论说图标问题，这代我是觉得不好看。-总得来说有点失望吧，与我而言一代真的是非常棒的游戏了，本体，海岸和梦都刷过好几遍，还是喜欢的不得了二代也是不错的游戏不过我不喜欢。4星还是给一代情怀了。,OPPO R7c,15,246,51
Calendula,4306420,https://www.taptap.com/user/4306420,gender-empty,2017-11-13 14:31:58,3分钟,5,哇这游戏我跟你们说就是疯狂吸萝莉，萝莉长大后疯狂吸软妹，要啥剧情啊要啥难度啊言归正传，二代比一代来说确实简单很多，当初玩儿一代主线以及扩充的时候难度是越来越难，到了后面甚至要思考才能过，但是二代几乎全部关卡都是秒过的就感觉钱花的不值啊2333(开玩笑有萝莉软妹就行)，照官方来说应该还会出扩充，一代的延续很有亮点，但是二代就不知道了毕竟整个从陪伴到分别到再会已经完成，希望官方脑洞大开吧，然后二代我二柱子的戏份太少了吧，而且还被主角疯狂踩眼睛，没柱权啊！！但二柱子刚登场的时候真的超感动，配上标题老友简直了。再扯点别的其实这游戏刚开局就设计成双主线能一开始就猜出来了，而且殊途同归的结局也在意料之中，，本作最大的亮点真的就是跟一代在关键机关上几乎没有相同的，真心佩服制作组的创造力，那个控制阳光的设定不要太赞。最后就是希望在扩充剧情中能增加难度，虽然这游戏就算单纯卖剧情画风音乐我也认了2333但是没有挑战的解密还是会有遗憾啊。,华为 P9 Plus,4,3,2
小江湖,6109361,https://www.taptap.com/user/6109361,gender-empty,2017-11-17 15:12:28,,4,这个游戏给人的感觉非常宁静安详。疼若画质更细腻就好了过程中感觉进去了个新世界……还有讯制新加入的一个小人非常非常可爱啊这代游戏比上代简单了一些，但是更能给人带来安静理戏情啊所以一定不要心疼那几十块钱啊！毕竟这个游戏曾给我那么多欢乐！,华为荣耀8,,1,
非洲咸鱼龙,229697,https://www.taptap.com/user/229697,male,2017-11-17 11:03:50,,4,这一代的重点放在了剧情上面，难度和流程降低了很多画面音乐很棒，通关画图的设定很有趣，最后一关母女合作也很棒但是难度降低后通关时间变短，一路平推过去没什么感觉有几关是纯粹的交代剧情剧情比较含蓄简短，全靠脑补期待下后续关卡吧,华为 荣耀V8,,1,
不是派大星是海星星,1289796,https://www.taptap.com/user/1289796,gender-empty,2017-11-16 13:38:10,,5,熟悉的画风就告诉我纪念碑谷又回来了(17610651-)77很多人也许会对第二代游戏的难度下降而有些许的不满，但是在我看来，这一定程度上增加了玩家的受众面，让一代一些因为剧情画风吸引但却因解密难度而望而却步的人回归游戏。其次呢，可圈可点的真的是二代的剧情，极好的诠释了什么叫成长，什么是孤勇...不仅如此，两个小人交互的部分微动作[比如先对视然后拥抱什么的]就很好的给玩家一种代入感，使得剧情所体现出的感情就更加立体。有些篇章的章节名字深得我心，比如说眠海之城这个就超级棒，其后的画面也的确迎合了章节名字。降低了一些解密难度，使得剧情更为完整，情感更加充沛，我认为这样的改进并不是一个错误的决定。一个游戏它要有开发者寄予它的思想它才能成为一个值得高分的作品。最后借我最喜欢的一个句子结束我的评论。至此之路将被铭记无限前途仍待解封以上。,华为荣耀V9,,,
魔仙堡堡主,1382987,https://www.taptap.com/user/1382987,female,2017-11-12 11:32:41,12分钟,4,看到有二的时候我是非常的激动啊，但我本来都已经准备好烧脑了，却发现对于被一折磨过的老玩家二就显的没那么让人眼前一亮，不过二的画面要好看很多啊，还有自己画的那个图，刚开始不知道要干啥，随便搞了个就完事了，搞完发现有点丑又跑回去重画了一个。二让我突然让我吓一跳的就是好像是玩完第二关就需要氪金才能玩了，对我这个刚过完双十一的人来说只能小声mmp了。我记得我玩一的时候好像也是有氪金的?但那个时候已经完全被一吸引了，二玩了两章就要氪金，且还没有被吸引，表示本仙女还没有那么大的氪金欲望。希望二能继续改进吧【不知道是不是因为腾讯...小声bb】,,,4,2
白兔,4476327,https://www.taptap.com/user/4476327,gender-empty,2017-11-15 17:38:20,,4,给四星吧，凭良心给的。第二季叙事性和角色代入感都没有第一部强，可玩性不够，就像是沿着第一部的路子又绕了一遍。但是不得不说，第二部的精细度比第一部高了不少，而终点的图案创新玩法也确实让人眼前一亮。第一季里的少女单枪匹马，唯美中带着淡淡孤勇；而第二季里少女变成了带着孩子的母亲，温馨感自然而然的流露出来。个人认为略有圈钱的意思，创新不足。但是精细度和淡淡的温暖却让人无法忽视，细小之间挥散不去。供参考。,华为荣耀8,,1,
J.YH.M,494073,https://www.taptap.com/user/494073,gender-empty,2017-11-16 17:05:51,,5,觉得一会儿就玩完了08不过瘾！《纪念碑谷2》在游戏众生中，是翘楚。唯美的画风、独特的玩法。但在1的基础上，没有很多惊艳的创新。1、分离与重逢刚开始还以为可以有不同的剧情，其实可以不分开……责怪了自己好一阵子。后来发现，并不能。2、光线与生长3、世界中的世界,三星 Galaxy S7 edge,,1,
