user_name,user_id,web,sex,time,play_time,score,comment,phone,huanle,dianzan,dianxia
Kokky,525348,https://www.taptap.com/user/525348,male,2017-11-07 16:21:57,,5,出于对这个游戏的感情果断买了，说说游戏体验吧，难度确实下降很大能看到很多1里面熟悉的玩法，但是在故事情节以及细节上做的越来越好有很多令人感动的点，她带着女儿冒险她的历程，女儿越长越大继承母亲的坚韧成为下一个艾达。图腾不论经过怎么的毁灭还是依然陪伴着艾达，不得不说图腾的出现才是游戏的开始。后面光合作用的树与每章结尾自己创造图案，这些新颖的点我都很喜欢。只要喜欢没有买了后不后悔什么的，大家放心玩(1711ω11)1718 。希望纪念碑谷以后做得更好，加油,魅族 M3,,8,
Sakura丨风停了丶,7700531,https://www.taptap.com/user/7700531,male,2017-11-10 18:33:46,,5,很棒，第一部，遗忘之滨，艾达的梦还有2都通关了，游戏难度不大的，熟悉的人一下就可以通关，第二部相比于第一部的风格感觉更加温暖。很有意思，不过毕竟众口难调，有的人喜欢有的人不喜欢也是正常。至于什么游戏内容不充实以及关卡太少的，第二部的关卡好像并不少，而且我觉得可能会像第一部一样再出续章之类的。不管如何，纪念碑谷带给我的除了美的享受，还有一定的教育意义，很棒！,一加手机5,,1,
甜蜜的风R恋,15844766,https://www.taptap.com/user/15844766,female,2017-11-11 01:31:45,,5,-本人目前也只玩了几关，在这里说一下吧-玩过的一代和二代的肯定发现二代的每个关卡的时间都变长了，可感觉有点简单的感觉，游戏好像变简单了???不知道你们怎么觉得.-画面依旧还是很精致的，现在还有一些动作细节简直了，还有就是背景音乐也是很好听的，推荐玩的时候可以开大声一些.-而且感觉这代的剧情还是不错的，自我感觉目前唯一的缺点就是难度有些下降，而且价格…嗯.-以上为自己的游戏体验.,vivo Y35A,1,,
天问道,2037800,https://www.taptap.com/user/2037800,gender-empty,2017-11-08 01:00:28,8分钟,4,对于游戏来说确实是佳作，听到熟悉的音乐风格和画面，讲的还是温馨的故事，让人沉浸在幽邃，神秘但又不失温暖的氛围里，但是，我并没有购买完整版，不是我不支持正版，而是觉得有点说不来，其实最开始看到腾讯代理的时候心里就不踏实，毕竟老马的德行大伙基本都知道，而且这次很多个翻译版本让我很不知所措，因为我根本就不了解这两位提供不同翻译的老师，这可能也是我比较抵触购买的原因吧,华为麦芒5,,,
Ee nauy,9346895,https://www.taptap.com/user/9346895,gender-empty,2017-11-10 17:21:35,,5,整体感觉很好！画风比第一代更加唯美，也从多种图形前进，很有艺术感。让我觉得最有趣的是第二关最后一个地方，玩家可以自己手动画出图形，很好玩，让我情不自禁的又玩了一次试了试画。缺点也有，画风很好，故事也很好，可是整体难度下降了........,魅族MX6,,1,
一叶之秋,12352987,https://www.taptap.com/user/12352987,gender-empty,2017-11-10 00:30:14,,5,不是很懂为什么tap上混进来那么多跟风无脑黑，买断制游戏收费也是要被喷的吗？竟然还有人说玩1的时候免费所以2是因为腾讯代理所以收费？玩盗版能不能别这么理直气壮啊，纪念碑谷除了限免的时候都是要付费的好不，我认为taper都应该是正版的支持者，以盗版为荣还嘲笑别人玩付费游戏的趁早出门左转吧／／／／／／／／／总体来说2相对于1难度有一些降低，又没有了1刚刚出现时的惊艳，所以主观上没有很多的新鲜感，不过作为正统续作，游戏素质还是很不错的，好评,三星 Galaxy S7 edge,,,
盗玖狐,7394398,https://www.taptap.com/user/7394398,gender-empty,2017-11-10 17:04:27,,5,真的，不知道你们是骂腾讯也好，说变简单了没有可玩性了也好，有一些片段，像妈妈和孩子分开前的回望，两人的拥抱，妈妈小时的的回忆，终于长大的孩子，还有最后的，停留在半路，没有跟着孩子走到最后的妈妈，真的让我哭死……,Xiaomi MI 5X,,1,
della,5809269,https://www.taptap.com/user/5809269,female,2017-11-07 16:35:17,30分钟,5,不是说2比1差，不是差。游戏可玩性还可以，难度下降好多，但是考虑不同年龄。实际上真的是5星给情怀，你要说画面好看是好看，可是TapTap上好看的游戏也不少。emmm就打完了免费的，也就十几分钟，就，还成吧，不知道后面不说啥。18元真的贵了，感觉8-12差不多，就酱。,华为Mate 7 高配版,,1,
TyPhonF,495151,https://www.taptap.com/user/495151,gender-empty,2017-11-10 16:33:59,,5,可能是因为玩过1的原因，觉得2没什么难度（这就是传说中的老油条嘛(6106516107)）而且整体玩下来，觉得与1有很大差距，内容少了，价钱贵了。剧情结构也感觉比较缺失，没1的好。当然，我并不是说2怎么怎么样...不能否认，2依旧是一款质量很好的游戏作品。只是，对于我而言，2并没有超越1，没有到达心中期待的高度。敬纪念碑谷！！！t(*07`*)s,小米5S,,1,
萌七,354814,https://www.taptap.com/user/354814,female,2017-11-07 06:50:56,,5,这不是一次游戏是一次心灵的启迪朽骨在此相迎山谷依然，只为静候新生萝尔，你看孩子追随母亲的脚步如使命传承般流转不息成长之快，爱意之切是不安，亦或是喜悦面对生命进程我们不乏勇气而是放手的决心你看，他做得很好！顺逆相随，让他羽翼自丰孤勇之后，世界尽在眼前而你，同样有更多探索世事变幻，但时间从不作答生命相承殊途同归你，也将继续完成属于自己的旅程在我们不断向前的途中不要忘了我们为何出发使命 轮回初心 永恒丰碑未竟仍在你手幽幽山谷流长披风静谧而待感谢她的教导你将拥有更不可预期的未来前途艰难，但谨记，你并不孤独你的成长有目共睹敬请期待下次旅程灵魂不息，使命必达静候你的归来――语录《纪念碑谷2》,小米 6,,9,
我R。,1366567,https://www.taptap.com/user/1366567,male,2017-11-09 23:35:07,,4,纪念碑古  我认为的神作。每一个故事，每一句台词感觉都有种内涵，配上洁净的多边风格，让我在一代的时候就深陷其中。二代出来，今天中午下载的，我崩坏3一元包都舍不得买，就纪念碑古2，一看价格加打折就买了  17.1块。。结果  我甚至觉得它只值七块，而且还是一代给它加的buff……最主要的就是难度，太简单了，完全没有一代那种坐床边啃一小时手指头的感觉，中午玩了一会，现在又玩到第十章了，舍不得玩了，，怕再玩一会就该卸载游戏了……哎，我说点什么好，如果再有一次机会，我希望它永远不要推出，至少能让我对二有一点期待,IUNI U3,,,
沐秋,13124503,https://www.taptap.com/user/13124503,female,2017-11-07 08:45:24,1小时50分钟,5,和第一部唯一不同的就是剧情了。母亲与孩子，很写实啊。刚开始是孩子跟随着母亲，是引导。后来孩子站在了母亲面前，是成长。然后孩子离开了母亲，是放飞。每一关结束后的几何画图真的不禁让人感叹数学之美！咳咳虽然我是个数学黑洞。游戏值得五星好评，17.1元很实惠了。虽然是双人的，感觉也并不是很难。,vivo Xplay 6,1,2,
9678临风◆悦夜78,2859510,https://www.taptap.com/user/2859510,gender-empty,2017-11-16 22:03:15,6分钟,5,会出纪念碑谷3吗？希望便宜点~加油！,OPPO R7,,,
欧阳,8173467,https://www.taptap.com/user/8173467,gender-empty,2017-11-09 14:36:04,,4,可能是第一部都玩过很多次的原因，所以第二部玩的都不会有太大难度。如果说第一部是关于孩子冒险道路上的探险精神和自我救赎，第二部则是更贴切现实的关于母亲和孩子之间的离愁别绪，真的非常贴切！剧情没有像第一部那么虚无缥缈却更能够使人感动，两个人的操作模式会令人有更多的新鲜感，但是难度不够又会使你通关后有意犹未尽的感觉。画面还是如之前一般无懈可击，剧情也是一样的不落俗套。第2部带来的更多的是成长成人道路上的感动，即便自己没有孩子或者你还只是没有到达那个年龄的孩子，也会感受到从一个母亲的内心折射出的感动！,小米5S,1,1,
手机用户12855091,12855091,https://www.taptap.com/user/12855091,gender-empty,2017-11-16 13:37:38,1小时32分钟,5,比纪念碑谷简单太多了。18RMB就玩了1小时左右01,华为荣耀8,,1,
泥巴嫩,8590862,https://www.taptap.com/user/8590862,gender-empty,2017-11-10 20:47:28,,5,虽然2的难度下降了，但是其中还是有很多新鲜的地方，比如随阳光生长的树，二人通关的设计......并且2的故事情节更加流畅，讲述了母亲对孩子的教育，孩子从依赖母亲到独立自我，并且孩子的身形也在不断成长，自我感觉玩纪念碑谷本就不是为了闯关，而是欣赏一部电影，一幅画，一曲音乐一段感情,OPPO R9sk,,,
牧星者,15776944,https://www.taptap.com/user/15776944,gender-empty,2017-11-09 20:46:31,,5,也许是因为玩过了好多次一代，所以对二代的期望度太高了，以至于感觉没那么惊艳了……不过各方面来说都还是很喜欢的！有一关树可以变大变小真是很意外了www还有踩到图腾的眼睛的话它会闭起来，超萌！难度总体来讲不大，有一些地方突然就卡住了，但自己来回转一转也很快就能看出来，通关后自己画图也是很神奇的操作了。剧情嘛，因为是有关亲情和成长的，温馨里带着一点点小酸涩，不像一代的乌鸦公主和图腾那么直观的震撼，但看着也是让人百感交集【上了年纪的叹息。总之是很喜欢啦！就是18块只有这么一点点关卡很不满足x,华为P9,,,
白夜04无霜,4890294,https://www.taptap.com/user/4890294,male,2017-11-10 20:46:31,,5,游戏依然很赞，依然延续了上一作的所有优点同样缺点也一样延续了过来…短，实在是短…剧情一知半解，虽然游戏性要超出剧情更多，但如果想做剧情就好好做，不要搞得让人浮想联翩（不过这一作的剧情会相对清晰一点）而优点自然如上一作一样，游戏性十足，脑力游戏爱好者的毒品级游戏（然而解毒的速度太快了）总结就是：短小精悍，1块1关，爱玩不玩，反正我买了,vivo X9Plus,,,
仙姑酱,15803508,https://www.taptap.com/user/15803508,female,2017-11-10 13:04:55,,4,剧情和感情丰富了很多。但是过关套路差不多。倒不如说1给人的感觉更加惊艳。但是这不代表2不好。各有所长吧。玩通之后只想说一句：easy to pass。hhh想不想入手就看各人是相对于对故事的追求还是对关卡的挑战欲望了。个人感觉文本无2。台词依旧经典。,vivo X9,,1,
白芷同志:),406647,https://www.taptap.com/user/406647,gender-empty,2017-11-10 19:34:23,,4,【仅属于个人见解，求同存异】给四星不是因为游戏体验吧。总觉得 好好的游戏一过腾讯手，盈利性质就变得很重（虽然1也要收钱）不过游戏的音效，美工，完全可以给满分的！各位dalao，带我看看第二关后的世界吧！不说了，氪金去,华为荣耀V8,,,
锦夏平生,5071434,https://www.taptap.com/user/5071434,gender-empty,2017-11-09 19:10:27,,5,画风一样的赞！！不过翻译版本………有点嫌弃………毕竟青春疼痛的文本什么的，我看得有点腻…………不过我超喜欢花纹还是图腾可以变这一点。不过关卡太简单了，还比1贵，怀疑翻译费占了不少┐(07-｀)┌不过，我更喜欢1的朽木枯骨。1的文字给人的感觉是，很神秘很神圣。2的文字……………青春疼痛，为赋新词强说愁？大概是这种感觉( ＿ ＿)ノ｜壁不知道你们有没有注意关卡主页面的暗纹你碰它它会变成金色，超棒。感觉2没有1给人一种惊艳感，可能是因为玩过1的缘故，但是2的画风超赞，沉迷截图无法自拔。,华为 荣耀畅玩5C,,,
today~hold tigh,12004287,https://www.taptap.com/user/12004287,male,2017-11-09 18:58:35,,4,第一部堪称完美，让第二部承载了太多的期待，导致它实际出来的时候却让人感到有些失望。花了一个小时左右通关了，首先剧情还是一如既往很棒，甚至比第一部更加有深度。然而，相比第一部而言，在玩法上并没有太多的改变，甚至难度远不如第一部，部分章节有偷工减料之嫌。撇开第一部来讲还是一款不错的游戏，但是作为玩家不可能将两部作品分而论之，这次制作商可以说某种程度上辜负了玩家。希望后续可以像第一部一样再出点新的资料片完善游戏体验。价格来说比第一部要贵，我愿意为自己期待已久的游戏花钱，但这次多多少少让我觉得这钱花的并不是物有所值。综合上面说的，我觉得给它四星最为稳妥。第一部我是强烈推荐大家买来玩玩的，至于这一部建议大家体验了免费的几关以后在理智地做出决定～,华为P9,,,
Sツ你i世承Z涵,8826048,https://www.taptap.com/user/8826048,gender-empty,2017-11-10 18:54:32,,4,我是玩过纪念碑谷1的老玩家（现在的纪念碑谷1成了什么样子我也不清楚），纪念碑谷2出了没时间玩，所以隔了一段时间才来玩。还没开始就要花钱买关卡，一款休闲游戏要先充钱才能正式开始玩（果断放弃）。本人不是特别喜欢 腾讯。,,,,
陨落-尼德霍格,14312645,https://www.taptap.com/user/14312645,gender-empty,2017-11-10 16:49:52,,5,游戏不错，具体好在哪里我就不说了（很多评论说过了）。不过作为一个曾经一天通关老版本的玩家来说，这个第二部太简单了，感觉完全没有难度，都没有挑战性了。希望能选择难度，老司机可以挑战困难的。最后五星好评，游戏不错，新手值得尝试，老玩家就不用说了，都等了好久了……,华为畅享5,,,
丿Dear灬落日,4715064,https://www.taptap.com/user/4715064,gender-empty,2017-11-10 16:39:52,,4,说真的有点小失望，关卡太少是硬伤，内容过得很快，而且难度不大，完全没有玩一时候想尽办法找路终得报的兴奋。基本每步路都给了十足的铺垫，很容易找到。当然，也有一些新的东西，而且过关之后的画图真的很喜欢，超美，要是能把内容再充实点就更好lw。,三星 Galaxy  S8,,,
多生事端、无过错,15585569,https://www.taptap.com/user/15585569,gender-empty,2017-11-08 15:22:02,,4,不给五星。玩了1后玩2会发现2过于简单，同一个章目下的大致思维都是一样的，没有特解烧脑的错综复杂。我买这个游戏是因为它的代入感和思考方式，但是1做到了，有的时候1会让我思考一会，发现原来可以用这种方法，为自己感到一丝骄傲，而2被我一小时多一点点时间通关了，没特别出彩，而且是不是章节明显没1做的内容多，也没有像是艾达的梦等额外篇章。18块钱虽说支持游戏，但是明显感觉到，2不尽人意。 内容挺水的，但是没广告也就这样吧。更新下 ，刚发现，1和2的占内存量差不多，而1却有了艾达的梦和被遗忘的海岸两个额外章，那2又是如此的急促，那么问题来了，是哪一块内容导致2的内存与1相同？再更新 谷歌的价格是4.99刀，看样子没打折的，你们不肯把钱给tx的，去淘宝买个礼品卡充值，挂个美国网络工具，冲进去在谷歌下。我淘宝上翻了下10刀65r左右，也符合汇率了。再更新。TapTap要我评论的时候做一份试卷，有一题是“不能无脑5星或1星” 对于那些因为要收费而打1星的我点了举报，但是，自己明知游戏差强人意，却依旧打了5星，情怀游戏么。你这么打分导致碑谷的后续做出一如既往的风格，好游戏不会被差评打败，但是却也会毁在无脑好评上！11.08更新    许多人说比剧情。一代讲的的自我赎罪，二代讲的亲情。自我赎罪跟亲情带给人的感觉从本质上就不一样，所能触发的共鸣就相差甚远，这就是2能赢在剧情上的原因。而如果碑谷2只有剧情能取胜，那18块钱一张电影票不错，能看1个小时的电影差不多就值18块。,vivo X7,,25,3
天狗Vincent,14368342,https://www.taptap.com/user/14368342,male,2017-11-10 16:13:15,,5,关于爱，成长，与责任一如既往的唯美。蹦蹦跳的小红帽好可爱，一步步看到她成长为婷婷少女的那一刻差点没感动地哭出来(25ω25 )。过关的脑洞一如既往的神奇喔~。嘛！竟然可以自己画神圣几何（画符）！太炫酷了！RQ能抽出ssr嘛/滑稽,红米Note 4X,,,
肖,10450959,https://www.taptap.com/user/10450959,gender-empty,2017-11-07 01:19:09,1小时19分钟,5,刚通关果然是传承或者说成长一开始父母带孩子，之后孩子带领父母，孩子独立，担当一面分别行走ps:这样看孩子带父母那节怪怪的，不过可以理解为叛逆吧从母亲的回忆来看，她们时代都是这样一辈带一辈得进行着这种传承,小米MIX,,2,
pathet,3467385,https://www.taptap.com/user/3467385,female,2017-11-09 15:13:31,,5,时隔快1年把 想着第一次同学推荐这种小清新游戏本以为这种风格不适合我没想到玩了进去 当初ios出2的时候期盼了好久终于是出了前几关和1很像就是颜色变了把没记错的话一开始还有点小失望，付费之后的几关几乎是一口气下来的，整体关卡上和1相比有提高啊一关平均下来4.5个场景，也有不同色调，玩完妈妈的部分之后也有孩子单独旅行，印象比较深的是果园那关，根据光线调植物生长这个创意我还是很喜欢的有几关场景还是略少啊可能是为了剧情准备的把，但是总体还是不错的，希望多出新的关卡把也希望稍微提一下难度,vivo X5SL,,,
平澜,4003027,https://www.taptap.com/user/4003027,gender-empty,2017-11-10 00:45:25,,5,我给满分，不怕他骄傲！2作较之前的一作难度有一点点下降，但是！！！剧情爆灯！！！新设计爆灯！！！超级棒，无论是画面，还是音乐，都在一作的基础上有很大提升！制作组没有辜负我们的期待！！！！！我好喜欢这一作！！！给制作组疯狂打call！！！！！！！！强烈推荐！！！,OPPO A59,,2,
手机用户15750003,15750003,https://www.taptap.com/user/15750003,gender-empty,2017-11-09 14:54:58,,5,说一说通关感受，纪念碑谷2的整体难度略有降低。在熟悉了1中的各种套路之后，2的通关并没有太大难度。~游戏情节一如既往的优雅，是的，我觉得优雅是最合适的一个词。无论是画面、音乐，亦或是三个不同版本的翻译，都给人非常宁静的美感。~个人认为这不是一个纯粹的益智类游戏，如何通关不是这个游戏的全部。如果不关注情节，你会失去很大的乐趣。三种翻译三种风格，不一样的感受，有时间建议大家都玩一遍。~评价给五星吧，虽然在关卡创新方面还是有小小的遗憾，不过整体还是很棒的啦d(72757075)17~,小米 6,,,
淡蓝蓝蓝i,4422458,https://www.taptap.com/user/4422458,female,2017-11-09 13:35:51,,5,只有我觉得二代比一代好玩吗？我觉得二代比一代画面更加精美了，而且代入感也很强。比如说，开始第二章那个路突然断掉，小女孩不停地奔跑，妈妈也在关注着孩子，那一刻真的吓到我了，一瞬间以为是个恐怖故事…还有很多的小创新也是一代所没有的，一代只有不停地移动变换，二代除了移动变换还有很多细节，比如说那个能变大变小的花，还有图腾身上的门等等…总体来说我觉得二代比一代更好一些，亲情的互动也比跟乌鸦的较量看起来更温暖些，唯一不足的就是太短了吧2333，另外如果能加cg就更好了c(〃66〃)17,一加手机3T,,,
少年,14366011,https://www.taptap.com/user/14366011,gender-empty,2017-11-08 23:03:58,,5,"纪念碑谷2终于完结了，2代和1代对比的话，2代的场景要比1代的场景好很多，让人心情舒畅，但难度减弱了一些。虽然要花钱，但我觉得是值得的，如果不花钱的话，那那些制作者们的辛苦就白费了，人家辛辛苦苦制作出来的游戏难到不要一些钱吗?如果不要钱哪那些他们的时间都白白浪费了，而且我觉得也不贵。（不喷了继续讲）一开始玩着玩着他们两个分开了，最后又重聚在了一起，多么动人的故事啊！（让我现在擦擦眼泪）也许这就是那母女情吧！现在我很期待3代，希望3代的场景更好，难度也增加一些，要不然2,3小时就玩完了。这款游戏我强烈推荐！！！五星必须的",三星 Galaxy On5,,2,
l,4927641,https://www.taptap.com/user/4927641,gender-empty,2017-11-09 13:27:23,,5,看了TapTap上的评论都很详细，作为1的脑残粉我就说的简单点吧（一点都不）。优点：1.一如既往的美美美，小清新壁纸软件（大雾）2.新的元素，靠光源生长的树还是让我有点小惊喜的3.自定义结束图案，画图这个简直让我爱死了，冲着这个我都觉得这钱花的值，图案炸开的时候少女（男）心也跟着炸了_(°:з」∠)_4.细节处理的很好，处女座的游戏啊，母亲和女儿明显的脚步不一样，女儿是一蹦一跳的走，很符合小孩子的设定，后面女儿的身高也慢慢变高了，脚步也变得跟母亲一样了，这种细节真的让人很舒服啊_(:°з」∠)_5.故事性更强了，相比前作孤独的公主来说，母女的设定更让人觉得更温暖，毕竟亲情总是很让人感动（我能说玩1的时候黄金图腾碎了我差点哭出来吗）母亲在送走女儿之后开始回顾自己小时候的故事，回忆完成后又开启女儿的故事部分，女儿一步步成长后和母亲重聚，结尾那张图已经成为我的壁纸了_(°:з」∠)_6.这是纪念碑谷啊！！！等了这么久终于出2了！！！这么精致的游戏的续作肯定要无条件支持！！！（脑残粉本质显露）缺点（也不能算缺点，只能算美中不足）1.太简单了，对于玩过1的老玩家来说2真的简单了很多，我基本都是一路畅通无阻，偶尔卡一下也能自己想出来，可能是熟悉了1的套路，所以还是希望能出像1第十关和两个番外一样有难度能让人思考一下过关了能有很大成就感的关卡（暗示出番外了02）2.太少了！！！不够玩！！！（暗示多出几个番外020202）,华为 P9 Plus,,,
菲,5948332,https://www.taptap.com/user/5948332,gender-empty,2017-11-08 22:57:43,,5,之前在ios上就玩过了，就感觉有生之年吧，真的超级喜欢这个游戏，画面非常清新，难度也没有到哪里去，对于我这种手残真的是太有好了。所以身为戏精的我又要开始演戏了，这次是妈妈和女儿的戏“妈妈，我摘到了一个浆果！给你吃！”“甜甜的真好吃。孩子啊，你也不小了，是时候该踏上征途了”“诶，那我以后都见不到妈妈了嘛？”“不会的哦，妈妈会永远陪在你的身边”“嘻嘻，那我踏上征途的时候，你会一直在我身边陪我嘛”“我一定会一直看着你的，不过，我可不能让你看见我，我们就玩捉迷藏，我来藏着你来找我好不好”“好啊好啊！那我开始数了，1234......”“孩子。再见。”（轻声）,OPPO A59,,2,
今年三岁,11261294,https://www.taptap.com/user/11261294,female,2017-11-09 12:23:11,,5,很多人说比起一部简单不少，其实自己感觉难度没有下降这么大，两部是有差别的，没什么好对比的，前几关玩起来很简单，到迷宫中的迷宫那里很是惊艳还有后续新出现的盆栽，让我小小的卡了会操作_(:з」∠)_，总的来说这个游戏依然让我爱不释手，踩到图腾眼睛的音效也十分可爱，有点残念就是图腾变成蓝的了，超喜欢亮黄的他像是温暖的小太阳，最后孩子的成长以及和母亲一起踏上征程，又温情又有些感慨，嘛………其实中途有些剧情没怎么懂，大概就这些啦。,vivo X7 Plus,,,
当初就不该下凡,2568136,https://www.taptap.com/user/2568136,female,2017-11-10 12:19:30,,4,说实话，不如前作。音乐和画面还是很美，但是关卡的设置上总觉得少了什么。玩一的时候沉醉其中根本停不下来，这个要不是花钱了是玩不下去的。饶雪漫的书我看了很多，但是这个翻译真心没懂。整个游戏的收获可能是被安利了蔡康永…,华为Mate 8,,,
